listing_id,listing_name,room_type,minimum_nights,price,host_id,host_name,is_superhost,created_at,updated_at
42420636,Komfort Zimmer im Hotel Brandies Berlin nahe Messe,Private room,1,101.0,337659501,,,2025-01-19 18:58:17+00:00,2025-01-19 18:58:17
44192332,Beautiful elegant apartment- Ludwig Hoffmann Park,Entire home/apt,30,100.0,67500313,,,2025-01-19 18:43:20+00:00,2025-01-19 18:43:20
36731204,Very Beautiful Very Cosy Flat in Great Location !,Entire home/apt,25,40.0,275339948,,,2025-01-19 18:34:18+00:00,2025-01-19 18:34:18
29222774,*NEW* sunny & spacious in the heart of Kreuzberg,Entire home/apt,14,105.0,11459975,Oliver & Anja,f,2025-01-19 18:33:41+00:00,2025-01-19 18:33:41
49591816,Pension im Grünen Reinickendorf Berlin,Entire home/apt,2,150.0,399844037,,,2025-01-19 18:26:51+00:00,2025-01-19 18:26:51
12659244,Sunny room,Private room,1,35.0,467817,Andreas,f,2025-01-19 18:03:51+00:00,2025-01-19 18:03:51
