listing_id,listing_name,room_type,minimum_nights,price,host_id,host_name,is_superhost,created_at,updated_at
11391873,Helles Balkonzimmer in Schöneberg,Private room,1,25.0,57241645,Klara,f,2025-01-17 13:42:37+00:00,2025-01-17 13:42:37
50646321,Central Falt in Prenzlauerberg,Entire home/apt,60,47.0,192200150,,,2025-01-17 13:34:12+00:00,2025-01-17 13:34:12
24308923,Schönes gemütliches WG-Zimmer,Private room,2,30.0,31643602,,,2025-01-17 13:32:51+00:00,2025-01-17 13:32:51
1694698,A home away from home in Berlin,Entire home/apt,1,189.0,8950990,George,f,2025-01-17 13:30:19+00:00,2025-01-17 13:30:19
49121163,Modern styled apartment Charlottenburg,Entire home/apt,14,60.0,22232550,Sand,f,2025-01-17 13:07:52+00:00,2025-01-17 13:07:52
